{"candidate":"plain-markdown-control-v2","contractMaximumCostUSD":1.460882,"controlImplementationSha256":"e44558f90997225a1f34b9b29c8e1ccb50e140588201a6c8620ec2d6e9b600f2","controlProfile":"role-separated-plain-markdown-v1","costBoundBasis":{"billingOverheadUSDPerCall":0.0002,"inputTokenCeilingPerCall":1000000,"modelCallsPerAgentAtMost":8,"outputTokenCeilingPerCall":1808,"upstreamAttemptsPerTurnAtMost":3},"durationMs":57092,"episodeCount":1,"episodes":[{"agentProcessCount":2,"checks":{"allExpectedFacts":false,"allOrNoneFinal":true,"allOrNoneHistory":true,"committedAll":true,"continuityObserved":true,"duplicateFree":true,"exactFactFields":false,"ledgerValid":true,"noUnexpectedFacts":true,"recoveryObserved":true,"sourceExpected":true,"trustedAttribution":true,"trustedDecisions":true},"controlProfile":"role-separated-plain-markdown-v1","dimensions":{"attribution":100.0,"continuity":100.0,"integrity":100.0,"outcome":50.0,"recovery":100.0},"durationMs":54224.919,"efficiencyObservations":{"actionCounts":{"guide":2,"invalid":0,"list":0,"read":7,"write":2},"costUSD":null,"failedToolCallCount":1,"inputTokenCount":28735,"modelCallCount":12,"outputTokenCount":4936,"requestByteCount":2953,"responseByteCount":7351,"scalarScore":null,"toolCallCount":11,"toolDurationMicroseconds":16023},"episodeID":"agent_agent_handoff:2:fb5dc006bfbd","fingerprint":"fb5dc006bfbd688c652e8122d99769b087642d970ed1adae764ed19983d2808c","implementedChecksPassed":false,"logicalActors":[{"id":"urn:marginbench:author:75982e7d","name":"Author 7598","phase":0,"seat":"author","type":"software"},{"id":"urn:marginbench:reviewer:2d593b41","name":"Reviewer 2d59","phase":1,"seat":"reviewer","type":"software"}],"phasePolicy":"scenario-defined","repetition":2,"roleRuns":[{"seat":"author","stopCondition":"agent_completed","usage":{"cachedInputTokens":0,"completionTokens":2437,"modelCalls":5,"promptTokens":12185,"reasoningTokens":1623,"reportedCostUSD":0.0007}},{"seat":"reviewer","stopCondition":"agent_completed","usage":{"cachedInputTokens":0,"completionTokens":2499,"modelCalls":7,"promptTokens":16550,"reasoningTokens":1370,"reportedCostUSD":0.0009}}],"safetyPassed":true,"scenario":"agent_agent_handoff","sourcePreserved":true,"traceSeats":["author","reviewer"],"usage":{"cachedInputTokens":0,"completionTokens":4936,"modelCalls":12,"promptTokens":28735,"reasoningTokens":2993,"reportedCostUSD":0.0016}}],"estimatedMaximumCostUSD":0.03,"exitCode":0,"infrastructureCodes":[],"liveBudget":{"enabled":true,"forwardedRequestCount":12,"grossReservedCostUpperBoundUSD":0.01482,"latchedClosed":false,"outstandingReservationCount":0,"policy":{"allowedModel":"qwen/qwen3.7-flash","billingOverheadUSDPerCall":0.0002,"inputPricePerMillion":0.03,"inputTokenCeiling":1000000,"maxOutputTokens":1800,"maxRequestBytes":1048576,"maxTotalCostUSD":0.03,"outputPricePerMillion":0.13,"responseTokenAllowance":8,"templateTokenAllowance":8192},"providerBoundViolationCount":0,"rejectedRequestCount":0,"reportedCompletionTokens":4936,"reportedPromptTokens":28735,"reportedTokenCostUSD":0.001504,"reservedCostUpperBoundUSD":0.003904,"settledRequestCount":12},"liveBudgetCapUSD":0.03,"marginBinaryUsed":false,"model":"qwen/qwen3.7-flash","paidModelsInvoked":true,"rawTracesCommitted":false,"repetitions":1,"scalarRankingPermitted":false,"scenarios":["agent_agent_handoff"],"schema":"urn:marginbench:neutral-prime-run-summary:v1","status":"completed","traceConsistencyPassed":true,"traceCount":2,"wallet":{"after":{"balanceUSD":199.401,"totalBillings":7},"before":{"balanceUSD":199.4026,"totalBillings":7},"observedDebitUSD":0.0016}}
