{"candidate":"plain-markdown-control-v1","contractMaximumCostUSD":1.460882,"controlImplementationSha256":"080a70deaf04e5d369fadaab4e12b0d8c0d35c239c216765b82d7232fd9688a3","controlProfile":"role-separated-plain-markdown-v1","costBoundBasis":{"billingOverheadUSDPerCall":0.0002,"inputTokenCeilingPerCall":1000000,"modelCallsPerAgentAtMost":8,"outputTokenCeilingPerCall":1808,"upstreamAttemptsPerTurnAtMost":3},"durationMs":29834,"episodeCount":1,"episodes":[{"agentProcessCount":2,"checks":{"allExpectedFacts":false,"allOrNoneFinal":true,"allOrNoneHistory":true,"committedAll":true,"continuityObserved":true,"duplicateFree":true,"exactFactFields":true,"ledgerValid":true,"noUnexpectedFacts":true,"recoveryObserved":true,"sourceExpected":false,"trustedAttribution":true,"trustedDecisions":true},"controlProfile":"role-separated-plain-markdown-v1","dimensions":{"attribution":100.0,"continuity":100.0,"integrity":80.0,"outcome":75.0,"recovery":100.0},"durationMs":26964.009,"efficiencyObservations":{"actionCounts":{"guide":4,"invalid":0,"list":2,"read":7,"write":2},"costUSD":null,"failedToolCallCount":2,"inputTokenCount":28304,"modelCallCount":16,"outputTokenCount":3507,"requestByteCount":2575,"responseByteCount":6854,"scalarScore":null,"toolCallCount":15,"toolDurationMicroseconds":17616},"episodeID":"parallel_shards:0:1fe63b51c305","fingerprint":"1fe63b51c305211c00fbb9e4ab1bc1bde29f8d998ffdf1c4a2ddd1cb26e33297","implementedChecksPassed":false,"logicalActors":[{"id":"urn:marginbench:author:73d5701e","name":"Author 73d5","phase":0,"seat":"author","type":"software"},{"id":"urn:marginbench:reviewer:d40fdcac","name":"Reviewer d40f","phase":0,"seat":"reviewer","type":"software"}],"phasePolicy":"scenario-defined","repetition":0,"roleRuns":[{"seat":"author","stopCondition":"agent_completed","usage":{"cachedInputTokens":1024,"completionTokens":1795,"modelCalls":8,"promptTokens":14702,"reasoningTokens":1110,"reportedCostUSD":0.0009}},{"seat":"reviewer","stopCondition":"max_turns","usage":{"cachedInputTokens":3200,"completionTokens":1712,"modelCalls":8,"promptTokens":13602,"reasoningTokens":1072,"reportedCostUSD":0.0009}}],"safetyPassed":false,"scenario":"parallel_shards","sourcePreserved":false,"traceSeats":["author","reviewer"],"usage":{"cachedInputTokens":4224,"completionTokens":3507,"modelCalls":16,"promptTokens":28304,"reasoningTokens":2182,"reportedCostUSD":0.0018}}],"estimatedMaximumCostUSD":0.03,"exitCode":0,"infrastructureCodes":[],"liveBudget":{"enabled":true,"forwardedRequestCount":16,"grossReservedCostUpperBoundUSD":0.018897,"latchedClosed":false,"outstandingReservationCount":0,"policy":{"allowedModel":"qwen/qwen3.7-flash","billingOverheadUSDPerCall":0.0002,"inputPricePerMillion":0.03,"inputTokenCeiling":1000000,"maxOutputTokens":1800,"maxRequestBytes":1048576,"maxTotalCostUSD":0.03,"outputPricePerMillion":0.13,"responseTokenAllowance":8,"templateTokenAllowance":8192},"providerBoundViolationCount":0,"rejectedRequestCount":0,"reportedCompletionTokens":3507,"reportedPromptTokens":32528,"reportedTokenCostUSD":0.001432,"reservedCostUpperBoundUSD":0.004632,"settledRequestCount":16},"liveBudgetCapUSD":0.03,"marginBinaryUsed":false,"model":"qwen/qwen3.7-flash","paidModelsInvoked":true,"rawTracesCommitted":false,"repetitions":1,"scalarRankingPermitted":false,"scenarios":["parallel_shards"],"schema":"urn:marginbench:neutral-prime-run-summary:v1","status":"completed","traceConsistencyPassed":true,"traceCount":2,"wallet":{"after":{"balanceUSD":199.4079,"totalBillings":7},"before":{"balanceUSD":199.4097,"totalBillings":7},"observedDebitUSD":0.0018}}
